{
  "episode_id": "episode_2025-12-08_dpp_lab_L1_03_battery_passport_minimal",
  "skill_id": "skill.mova_check_basic",
  "envelope_id": "env.mova_check_run_v1",
  "status": "planned",
  "actor": {
    "role": "agent",
    "id": "codex_vscode_main"
  },
  "started_at": "2025-12-08T14:10:00Z",
  "finished_at": "2025-12-08T14:10:00Z",
  "input": {
    "request_ref": "lab/skill_runs/mova_check_basic.L1_03_battery_passport_minimal_run_request.json",
    "envelope_ref": "lab/examples/env.mova_check_run_v1.dpp_lab.ds_lab_battery_passport_minimal.json"
  },
  "output": {
    "binding_reason": "no_bindings_in_registry",
    "notes": "Planned via run_skill_plan.js; execution pending runtime binding."
  },
  "meta": {
    "domain": "dpp_lab",
    "labels": [
      "mova_check_basic",
      "L1_03"
    ]
  }
}
