{
  "episode_id": "episode_2025-12-09_dpp_lab_L3_01_dpp_passport_normalize_schema",
  "skill_id": "skill.mova_check_basic",
  "envelope_id": "env.mova_check_run_v1",
  "status": "succeeded",
  "actor": {
    "role": "agent",
    "id": "codex_vscode_main"
  },
  "started_at": "2025-12-09T12:45:00Z",
  "finished_at": "2025-12-09T12:45:00Z",
  "input": {
    "request_ref": "lab/skill_runs/mova_check_basic.L3_01_dpp_passport_normalize_schema_run_request.json",
    "envelope_ref": "lab/examples/env.mova_check_run_v1.dpp_lab.ds_dpp_passport_normalize_input_v1.json"
  },
  "output": {
    "result_ref": "lab/skill_runs/mova_check_basic.L3_01_dpp_passport_normalize_schema_result.json"
  },
  "meta": {
    "domain": "dpp_lab",
    "labels": [
      "dpp_lab",
      "L3_01",
      "dpp_passport_normalize_contracts"
    ]
  }
}
