{
  "episode_id": "episode_2025-12-10_repo_change_plan_WF_LAB_06_WF_EX_002_smartlink_setup",
  "skill_id": "skill.repo_code_change_plan_basic",
  "envelope_id": "env.repo_change_plan_run_v1",
  "status": "planned",
  "actor": {
    "role": "agent",
    "id": "codex_cli"
  },
  "started_at": "2025-12-10T14:00:00Z",
  "finished_at": null,
  "input": {
    "$ref": "lab/skill_runs/repo_code_change_plan.mova_skills_lab.WF_LAB_06_WF_EX_002_smartlink_setup.json"
  },
  "output": null,
  "error": null,
  "meta": {
    "labels": [
      "WF_LAB_06",
      "WF_EX_002",
      "lab_workflow",
      "smartlink"
    ],
    "note": "Planning envelope for SmartLink experiment setup."
  }
}
