{
  "episode_id": "episode_2025-12-08_dpp_lab_L2_01_dpp_passport_read_workflow",
  "skill_id": "skill.repo_code_change_plan_basic",
  "envelope_id": "env.repo_change_plan_run_v1",
  "status": "succeeded",
  "actor": {
    "role": "agent",
    "id": "codex_vscode_main"
  },
  "started_at": "2025-12-08T18:00:00Z",
  "finished_at": "2025-12-08T18:00:00Z",
  "input": {
    "request_ref": "lab/examples/env.repo_change_plan_run_v1.dpp_lab.L2_01_dpp_passport_read_workflow.json",
    "run_ref": "lab/skill_runs/repo_code_change_plan.dpp_lab.L2_01_dpp_passport_read_workflow.json"
  },
  "output": {
    "plan_notes": "Plan for L2_01 to add env.dpp_passport_read_v1 envelope, public/manufacturer/verifier examples, mova_check run, and snapshot."
  },
  "meta": {
    "domain": "dpp_lab",
    "labels": [
      "dpp_lab",
      "L2_01",
      "dpp_passport_read_workflow"
    ]
  }
}
