{
  "episode_id": "episode_2025-12-08_dpp_lab_L1_05_mova_check_stronger_minimal",
  "skill_id": "skill.repo_code_change_plan_basic",
  "envelope_id": "env.repo_change_plan_run_v1",
  "status": "succeeded",
  "actor": {
    "role": "agent",
    "id": "codex_vscode_main"
  },
  "started_at": "2025-12-08T15:00:00Z",
  "finished_at": "2025-12-08T15:00:00Z",
  "input": {
    "request_ref": "lab/examples/env.repo_change_plan_run_v1.dpp_lab.L1_05_mova_check_stronger_minimal.json",
    "run_ref": "lab/skill_runs/repo_code_change_plan.dpp_lab.L1_05_mova_check_stronger_minimal.json"
  },
  "output": {
    "plan_notes": "Plan to strengthen minimal battery passport per mova_check feedback, re-run mova_check_basic, and snapshot results."
  },
  "meta": {
    "domain": "dpp_lab",
    "labels": [
      "L1_05_mova_check_stronger_minimal",
      "dpp_lab"
    ]
  }
}
