{
  "episode_id": "episode_2025-12-10_WF_LAB_05_lab_workflow_baseline_vs_codex_examples",
  "skill_id": "skill.mova_check_basic",
  "envelope_id": "env.mova_check_run_v1",
  "status": "succeeded",
  "actor": {
    "role": "agent",
    "id": "codex_cli"
  },
  "started_at": "2025-12-10T13:50:00Z",
  "finished_at": "2025-12-10T13:52:00Z",
  "input": {
    "$ref": "lab/examples/env.mova_check_run_v1.WF_LAB_05_lab_workflow_baseline_vs_codex_examples.json"
  },
  "output": {
    "$ref": "lab/skill_runs/mova_check_basic.WF_LAB_05_lab_workflow_baseline_vs_codex_examples_result.json"
  },
  "error": null,
  "meta": {
    "labels": [
      "lab_workflow",
      "WF_LAB_05",
      "WF_EX_001",
      "baseline_vs_codex"
    ],
    "note": "Validation for WF-EX-001 baseline vs codex artifacts."
  }
}
