{
  "episode_id": "episode_2025-12-10_repo_change_plan_WF_LAB_01_lab_workflow_schemas_and_envelopes",
  "skill_id": "skill.repo_code_change_plan_basic",
  "envelope_id": "env.repo_change_plan_run_v1",
  "status": "planned",
  "actor": {
    "role": "agent",
    "id": "codex_cli"
  },
  "started_at": "2025-12-10T09:40:00Z",
  "finished_at": null,
  "input": {
    "envelope_id": "env.repo_change_plan_run_v1",
    "verb": "transform",
    "resource": "code_change_plan",
    "input": {
      "repo_snapshot_md": "# MOVA Skills Lab (2025-12-10)\n\n- Red core: `core/mova` with MOVA 4.0.0 schemas/envelopes and global vocabulary, kept stable.\n- Yellow layer: infrastructure skills (`repo_snapshot_basic`, `repo_code_change_plan_basic`, `skill_ingest_*`, `mova_ai_bootstrap_generate_basic`, etc.) registered in `lab/skills_registry_v1.json`.\n- Green layer: lab docs and memory (`docs/PROJECT_MEMORY/**`, `lab/memory/SQLITE_MEMORY_SNAPSHOT_*`), workflow lab overview/TZ docs in `docs/lab_workflow_experiment_*`.\n- Tools: `tools/validate_lab.js`, `tools/run_skill_plan.js`, npm scripts (`validate`, `test`, `memory:*`).\n- Current focus: add lab workflow experiment schemas/envelopes without touching MOVA core.",
      "goal_summary": "WF_LAB_01 â€” create a lab-only workflow experiments branch, add schemas/envelopes for lab_workflow_* per TZ docs, keep MOVA 4.0.0 core untouched.",
      "change_kind_hint": "infra_change",
      "must_not_touch": [
        "core/mova/**"
      ],
      "preferred_areas": [
        "schemas/lab/**",
        "envelopes/lab/**",
        "docs/**",
        "lab/examples/**",
        "lab/skill_runs/**"
      ],
      "constraints_md": "Work strictly in the green lab layer; keep compatibility with MOVA 4.0.0 contracts; avoid modifying core/mova. Base on latest DPP lab snapshot after L3_03 normalize export verifier workflow.",
      "initial_files_of_interest": [
        {
          "path": "docs/lab_workflow_experiment_overview_v1.md",
          "reason": "Overview of workflow lab scope and roles."
        },
        {
          "path": "docs/lab_workflow_experiment_schemas_tz_v1.md",
          "reason": "Canonical TZ for lab_workflow_* schemas/envelopes."
        },
        {
          "path": "docs/lab_workflow_experiment_first_pattern_v1.md",
          "reason": "First workflow experiment pattern guidance."
        },
        {
          "path": "lab/memory/SQLITE_MEMORY_SNAPSHOT_20251210_092946.json",
          "reason": "Latest SQLite memory snapshot with DPP lab episodes."
        }
      ]
    },
    "meta": {
      "project_id": "mova_skills_lab",
      "labels": [
        "WF_LAB_01",
        "lab_workflow",
        "dpp_after_L3_03"
      ],
      "domain": "lab_workflow",
      "requested_at": "2025-12-10T00:00:00Z"
    }
  },
  "output": null,
  "error": null,
  "meta": {
    "note": "Planning envelope prepared for WF_LAB_01; execution pending available runtime.",
    "recorded_by": "codex-cli"
  }
}
