{
  "episode_id": "episode_2025-12-09_dpp_lab_L3_01_dpp_passport_normalize_contracts",
  "skill_id": "skill.repo_code_change_plan_basic",
  "envelope_id": "env.repo_change_plan_run_v1",
  "status": "succeeded",
  "actor": {
    "role": "agent",
    "id": "codex_vscode_main"
  },
  "started_at": "2025-12-09T12:40:00Z",
  "finished_at": "2025-12-09T12:40:00Z",
  "input": {
    "request_ref": "lab/examples/env.repo_change_plan_run_v1.dpp_lab.L3_01_dpp_passport_normalize_contracts.json",
    "run_ref": "lab/skill_runs/repo_code_change_plan.dpp_lab.L3_01_dpp_passport_normalize_contracts.json"
  },
  "output": {
    "plan_notes": "Plan for L3_01 to add normalize input/envelope schemas with examples, mova_check runs, and snapshot."
  },
  "meta": {
    "domain": "dpp_lab",
    "labels": [
      "dpp_lab",
      "L3_01",
      "dpp_passport_normalize_contracts"
    ]
  }
}
