{
  "episode_id": "episode_2025-12-10_repo_snapshot_WF_LAB_03_WF_EX_001_baseline_run_01",
  "skill_id": "skill.repo_snapshot_basic",
  "envelope_id": "env.repo_snapshot_run_v1",
  "status": "succeeded",
  "actor": {
    "role": "agent",
    "id": "codex_cli"
  },
  "started_at": "2025-12-10T12:35:00Z",
  "finished_at": "2025-12-10T12:37:00Z",
  "input": {
    "$ref": "lab/skill_runs/repo_snapshot_WF_LAB_03_WF_EX_001_baseline_run_01_request.json"
  },
  "output": {
    "snapshot_ref": "docs/PROJECT_MEMORY/PROJECT_SNAPSHOT_2025-12-10_mova_skills_lab_WF_LAB_03_WF_EX_001_baseline_run_01.json"
  },
  "error": null,
  "meta": {
    "labels": [
      "WF_LAB_03",
      "WF_EX_001",
      "lab_workflow"
    ],
    "note": "Snapshot captured after WF-EX-001 baseline run artifacts."
  }
}
