{
  "episode_id": "episode_2025-12-10_repo_snapshot_WF_LAB_06_WF_EX_002_smartlink_setup",
  "skill_id": "skill.repo_snapshot_basic",
  "envelope_id": "env.repo_snapshot_run_v1",
  "status": "succeeded",
  "actor": {
    "role": "agent",
    "id": "codex_cli"
  },
  "started_at": "2025-12-10T14:14:00Z",
  "finished_at": "2025-12-10T14:16:00Z",
  "input": {
    "$ref": "lab/skill_runs/repo_snapshot_WF_LAB_06_WF_EX_002_smartlink_setup_request.json"
  },
  "output": {
    "snapshot_ref": "docs/PROJECT_MEMORY/PROJECT_SNAPSHOT_2025-12-10_mova_skills_lab_WF_LAB_06_WF_EX_002_smartlink_setup.json"
  },
  "error": null,
  "meta": {
    "labels": [
      "WF_LAB_06",
      "WF_EX_002",
      "lab_workflow",
      "smartlink"
    ],
    "note": "Snapshot captured after WF-EX-002 SmartLink setup artifacts."
  }
}
